{
  "$schema": "../evidence.schema.json",
  "version": 1,
  "id": "gitlab-com",
  "class": "B",
  "mechanism": "form",
  "source": "https://github.com/gitlabhq/gitlabhq/blob/ecff27ae76032d42095793aa7639d3e73ae6f0de/app/assets/javascripts/authentication/sign_in/components/sign_in_form.vue",
  "reviewed": "2026-10-12",
  "summary": "The same sign-in form as the reviewed self-hosted GitLab profile: one POST form (sign-in-form) at /users/sign_in. The software is public, but what gitlab.com serves was not observed, and its two-step sign-in can replace this layout per request.",
  "sources": [
    {
      "id": "sign-in-form",
      "kind": "public-source",
      "title": "GitLab 19.4.2 sign-in form component (public mirror of the open-source edition)",
      "url": "https://github.com/gitlabhq/gitlabhq/blob/ecff27ae76032d42095793aa7639d3e73ae6f0de/app/assets/javascripts/authentication/sign_in/components/sign_in_form.vue",
      "commit": "ecff27ae76032d42095793aa7639d3e73ae6f0de",
      "version": "19.4.2",
      "retrieved": "2026-10-12"
    },
    {
      "id": "reviewed-form",
      "kind": "repository",
      "title": "This repository's test of the reviewed self-hosted GitLab form: the rendered form with its ids, field names and test ids",
      "path": "tests/protocol/hostedDashboardLoginClient.test.ts",
      "lines": "40",
      "retrieved": "2026-10-12"
    },
    {
      "id": "password-input",
      "kind": "public-source",
      "title": "GitLab 19.4.2 password input component: name and test id are passed through, the type starts as password",
      "url": "https://github.com/gitlabhq/gitlabhq/blob/ecff27ae76032d42095793aa7639d3e73ae6f0de/app/assets/javascripts/authentication/password/components/password_input.vue",
      "commit": "ecff27ae76032d42095793aa7639d3e73ae6f0de",
      "version": "19.4.2",
      "lines": "80-122",
      "retrieved": "2026-10-12"
    },
    {
      "id": "field-names",
      "kind": "public-source",
      "title": "GitLab 19.4.2 sign-in view: the field names are generated by the server form for the user model and handed to the component",
      "url": "https://github.com/gitlabhq/gitlabhq/blob/ecff27ae76032d42095793aa7639d3e73ae6f0de/app/views/devise/sessions/_new_base.html.haml",
      "commit": "ecff27ae76032d42095793aa7639d3e73ae6f0de",
      "version": "19.4.2",
      "lines": "9-16",
      "retrieved": "2026-10-12"
    },
    {
      "id": "test-helper",
      "kind": "public-source",
      "title": "GitLab 19.4.2 feature-test helper: signs in through the fields user_login and user_password, then user_otp_attempt",
      "url": "https://github.com/gitlabhq/gitlabhq/blob/ecff27ae76032d42095793aa7639d3e73ae6f0de/spec/support/helpers/login_helpers.rb",
      "commit": "ecff27ae76032d42095793aa7639d3e73ae6f0de",
      "version": "19.4.2",
      "lines": "83-93",
      "retrieved": "2026-10-12"
    },
    {
      "id": "two-step-flag",
      "kind": "public-source",
      "title": "GitLab 19.4.2 feature flag two_step_sign_in: described as GitLab.com 2-step sign-in, a beta flag that is off by default",
      "url": "https://github.com/gitlabhq/gitlabhq/blob/ecff27ae76032d42095793aa7639d3e73ae6f0de/config/feature_flags/beta/two_step_sign_in.yml",
      "commit": "ecff27ae76032d42095793aa7639d3e73ae6f0de",
      "version": "19.4.2",
      "retrieved": "2026-10-12"
    },
    {
      "id": "controller",
      "kind": "public-source",
      "title": "GitLab 19.4.2 sessions controller: the two-step flag is evaluated per request; a CAPTCHA can be required on login",
      "url": "https://github.com/gitlabhq/gitlabhq/blob/ecff27ae76032d42095793aa7639d3e73ae6f0de/app/controllers/sessions_controller.rb",
      "commit": "ecff27ae76032d42095793aa7639d3e73ae6f0de",
      "version": "19.4.2",
      "lines": "29-194",
      "retrieved": "2026-10-12"
    },
    {
      "id": "website-terms",
      "kind": "vendor-documentation",
      "title": "GitLab Website Terms of Use, section 3 (responsibility of website visitors): no process, automated or otherwise, may retrieve, scrape or reproduce the presentation of the website. The reason the hosted page was not captured.",
      "url": "https://handbook.gitlab.com/handbook/legal/policies/website-terms-of-use/",
      "retrieved": "2026-10-12"
    }
  ],
  "selectors": [
    {
      "selector": "form#sign-in-form input[name=\"user[login]\"][autocomplete=\"username\"]",
      "role": "username",
      "source": "reviewed-form",
      "basis": "observed",
      "locator": "line 40; source sign-in-form lines 16, 99-112 and 226-233 write the form id and the autocomplete value; source test-helper line 83 fills user_login"
    },
    {
      "selector": "form#sign-in-form input[name=\"user[password]\"][type=\"password\"]",
      "role": "password",
      "source": "reviewed-form",
      "basis": "observed",
      "locator": "line 40; source sign-in-form lines 250-259; source password-input lines 86-88 and 113-118; source test-helper line 84 fills user_password"
    },
    {
      "selector": "form#sign-in-form button[data-testid=\"sign-in-button\"][type=\"submit\"]",
      "role": "control",
      "source": "reviewed-form",
      "basis": "observed",
      "locator": "line 40; source sign-in-form lines 282-291",
      "note": "The passkey button is a submit button of a second form on the page, outside form#sign-in-form."
    }
  ],
  "fixtures": [
    {
      "file": "fixture.html",
      "path": "/users/sign_in",
      "derivedFrom": ["sign-in-form", "password-input", "reviewed-form"],
      "note": "The single-form layout (two-step sign-in off), with the passkey form beside it."
    }
  ],
  "staysInteractive": [
    {
      "kind": "captcha",
      "note": "The form has a CAPTCHA slot that the server turns on for some requests."
    },
    {
      "kind": "totp",
      "note": "The verification code page has two layouts behind a flag; neither is pinned here."
    },
    {
      "kind": "email-code",
      "note": "The sign-in page initialises an email verification component (a code sent by email). When the site shows it was not read."
    },
    {
      "kind": "passkey"
    },
    {
      "kind": "single-sign-on",
      "note": "Provider buttons are rendered under the form, outside it."
    }
  ],
  "unverified": [
    "What gitlab.com serves. The hosted page was not rendered (source website-terms), and the site runs ahead of releases with its own flag settings; the selectors are those of release 19.4.2.",
    "Whether two-step sign-in is on for a given request on gitlab.com. With it on, the page first shows only the username field, and these steps stop as a layout mismatch with nothing typed.",
    "Where two-step sign-in sends an account that lives on another cell, and whether that leaves the gitlab.com origin.",
    "Additions of the hosted edition: the public mirror read here does not contain the ee directory, so anything gitlab.com adds to the sign-in page from there was not read."
  ],
  "neededFromUser": "One sign-in on gitlab.com with this layout, or the signed-out sign-in page saved as \"Webpage, Complete\", to show which layout the account gets. Save any page signed out and with no password typed in; keep the \"_files\" folder beside the .html and both outside the repository: they can hold the account name.",
  "schemaGaps": [
    "Two alternative layouts on one origin and path: the single form, and the two-step form in which the same button first checks the username and the password field is added to the form afterwards. A steps file can describe one of them; the single form was chosen because it is the release default."
  ],
  "notes": "Labelled B although every selector is observed: the evidence covers the software, not the hosted deployment. robots.txt of gitlab.com allows /users/sign_in, but the website terms do not allow automated retrieval, so no capture was made."
}
